{
  "id": "ref.residential.<object>.<yyyymmdd>.001",
  "source_type": "user_provided",
  "source_name": "user screenshot or catalog note",
  "source_uri_or_local_ref": "references/<file-or-local-note>",
  "license_status": "internal_only",
  "ingest_date": "YYYY-MM-DD",
  "domain": "residential",
  "object_tags": ["sofa"],
  "part_tags": ["seat", "back", "armrest"],
  "style_tags": ["modern"],
  "view_type": "plan",
  "usage_boundary": "reference_only",
  "privacy_boundary": "redacted",
  "notes": "Reference only. Do not clone geometry or treat as system_verified."
}
